Vendor, Category, Item, Item Description, Price, Origin, Destination, Rating, Remarks
710HookUp,Drugs/Cannabis/Concentrates,7g Dewaxed XJ-13 Snap n Pull,7g of Dewaxed XJ-13   All fat and lipids have been removed for your medical enjoyment!  *Photo will be added soon!*,0.36117073,USA,,4.95/5,
710superstore,Drugs/Cannabis/Concentrates,Girl Scout Cookies BHO Wax *14 Gram*,Girl Scout Cookies BHO Wax *14 Gram*  Girl Scout Cookies  or GSC  is an OG Kush and Durban Poison hybrid cross whose reputation grew too large to stay within the borders of its California homeland. ...,2.497426459,USA,,~5/5,
accept,Drugs/Cannabis/Concentrates,CANNABIS / BHO / WAX / OIL / SHATTER: 3g. 2-4 DAY MAIL,CANNABIS / BHO / WAX / OIL / SHATTER: 3g  Current Strain: California Blackberry Kush Pull & Snap Wax  AAA WAX - appearance will differ from picture. If wax is sticky  put it in freezer for 1 minu ...,0.486514602,USA,USA,4.97/5,
AfriKanSun,Drugs/Cannabis/Concentrates,Swazi Kief 10g,Swazi Kief ~  A dry sifted tichomes from a variety of Swazi strain....  Ideal to mix in with your smoke of choice  can also be used in edible recipes.,0.270289664,SouthAfrica,,4.83/5,
alchemycd,Drugs/Cannabis/Concentrates,MA-CHMACA    100g,"Synonyms	•	AMB N-methylcyclohexyl analog •	AB-CHMINACA •	MAB-AB-CHMINACA Formal Name	methyl (1-(cyclohexylmethyl)-1H-indazole-3-carbonyl)-L-valinate  Molecular Formula	C21H29N3O3 Formula Weight ...",365.8168484,China,,4.86/5,Average price may be skewed outliar > .5 BTC found
androgenie,Drugs/Cannabis/Concentrates,Weed Cannabis Disposable Vapor Pen (High CBD) THC - 87.9% - Hybrid Strain - Co2 Extracted,Hybrid Strain (High CBD) THC - 87.9% CBD - 3.20% TCC (Total Cannabinoid Content) - 93.9%   -C02 Extraction for 100% Pure Cannabis... Naturally.  -Discrete and easy to use  -No charging or f ...,0.27385743,USA,USA,4.88/5,
arctic,Drugs/Cannabis/Concentrates,High Quality Wax | 1 Oz,This listing is for 1 oz of high quality BHO  purged and potent.   Price is $550/oz with free shipping and full escrow.  **************  * Message me with any questions/concerns. All messages  ...,2.146116407,USA,,4.99/5,
bcdirect,Drugs/Cannabis/Concentrates,1 Gram Budder 99.6 % THC Concentrate***Free Shipping Worldwide!***,1 Gram Budder 99.6 % THC Concentrate  There's nothing better than Budder!  This budder is made from sugar leaf from all of our AAA indoor varities. It is 99.6 pure THC  meaning that one gram woul ...,0.206136617,Canada,,4.860/5,
Big_Boy,Drugs/Cannabis/Concentrates,7 Grams of High Quality Crumble/Wax BHO (Querkle),This listing is for 7 grams of High Quality Crumble/Wax BHO purged on a closed loop system. The current strain of this batch is Querkle.,0.870126988,USA,,5.00/5,
Bisto,Drugs/Cannabis/Concentrates,Copy of Bar of 420 chocolate 10 strong hits,This is for a 55g+ bar of Chocolate and believe me one chunk is a nice hit. Great tasting chocolate with an amazing taste of bud.  We are giving this a push as the product is amazing. Edibles are ...,0.23006108,UK,UK,4.935/5,
boomers,Drugs/Cannabis/Concentrates,indica rso --- dabs --- honey oil,1g of rso extracted using iso method  The advantage of iso over butane extraction is that some chemicals from the butane can remain unless purged under pressure for many hours  whereas isopropol al ...,0.489342994,UK,,4.98/5,
brownjames,Drugs/Cannabis/Concentrates,1 Gram of East Coast Sour Diesel Shatter (Nug Run),For sale is some A+ medical grade wax made from East Coast Sour Diesel nugs. It comes directly from a medical dispensary and has been tested to contain no residual solvents. Sour Diesel is a sativa w ...,0.08518177,USA,Worldwide,5.00/5,
BudBuddy,Drugs/Cannabis/Concentrates,The Church Iso Hash 5 g,Tillverkat på ca 100 gram trim och småbuds. Skickas vakuumförpackat i vadderat kuvert.,0.34924528,Sweden,,~5/5,
buddercup,Drugs/Cannabis/Concentrates,28g 1oz Bubba Kush Glass Shatter Concentrate Wax TOP QUALITY (CLOSED LOOP / VAC PURGED / NUG RUN,Buddercup is back and has returned to a loyal following of fans with better concentrates than ever. Everything you heard is true -- you are about to order the best quality concentrates on the darknet ...,3.959378849,Canada,Canada,4.98/5,Average price may be skewed outliar > .5 BTC found
BudMasterGeneral,Drugs/Cannabis/Concentrates,WOW vape CBD ONLY! cartridge  @$49,WOWvape cartridge CBD ONLY !!! ORGANIC 510 thread standard CO2 Subcritical Industrial Hemp Oil Solvent Free! Organic! Steep Hill SafeConcentrate CERTIFIED!  Wow vape prefilled cartridges are  ...,0.186902085,USA,USA,4.79/5,
BudsNRoses,Drugs/Cannabis/Concentrates,7 Grams Premium Wax,This wax is made from Premium quality OG Kush and is vacuum-purged multiple times. This wax is extremely tasty and smooth on the exhale while delivering a punch that your sure to remember. We take jo ...,1.026294381,USA,,4.965/5,
budwax,Drugs/Cannabis/Concentrates,28g Indica BHO Shatter TOP SHELF 20/g,Top Shelf Shatter  Ships priority in a box FREE SHIPPING,2.062598276,USA,USA,~5/5,
Cafe_Deluxe,Drugs/Cannabis/Concentrates,1G Of Medical Grade CBD Gold Oil - Co2 Extracted - 240MG CBD,This CBD oil is the best in the industry  extracted from CBD rich Hemp  this oil consistency is slippy like as it has a 49% fatty acid content  perfect for sublingual use  sublingual ( under the tong ...,0.190704482,UK,,4.966/5,
CaliforniaGreenCross,Drugs/Cannabis/Concentrates,1g + SHATTER + HIGHEST QUALITY + 90% THC,25% OFF SALE ON ALL SHATTER LISTINGS + 1g SALE PRICE: $60 - OLD PRICE: $81 + $21 SAVINGS FOR THIS ITEM   + CaliforniaGreenCross + PROFESSIONAL + VERIFIED + TRUSTED VENDOR + 100% SATISFACTION GUARA ...,150.2763808,USA,USA,4.993/5,Average price may be skewed outliar > .5 BTC found
CannaKing,Drugs/Cannabis/Concentrates,RECHARGEABLE VAPE PEN & CARTRIDGE SET,"For those who have tried our disposable CO2 pens  these rechargeable pens are X5 stronger and hit harder!!!  Comes with one (1) ""FOO DOG"" oil cartridge. Made from real FOO DOG nugs!  The battery  ...",0.268410317,USA,WORLDWIDE,4.94/5,
CB2013,Drugs/Cannabis/Concentrates,4oz. Kings Nectar,Great wax..Great price...Extracted from Multiple OG strains....comes in x 7 gram containers.16 silicon  containers total..No escrow/US only,5.11090667,USA,usa,4.948/5,
chipzahoy,Drugs/Cannabis/Concentrates,cust order 0043,1 Oz BK Shatter $650  1 Oz PK Shatter $650  2 Gr Wax - Free  Plus express post shipping. Please choose below. :)  Thanks!  Chipz,5.352624649,Canada,Worldwide,4.896/5,Average price may be skewed outliar > .5 BTC found
Christy_Nugs,Drugs/Cannabis/Concentrates,60 grams hash oil,absolutely NO NEW customers! if u have not ordered from me before bummer!  this listing is for 60 grams of hash oil packed into a large syringe. it has a screw on cap - neat and tidy. easy dispen ...,4.742924935,USA,USA,4.992/5,Average price may be skewed outliar > .5 BTC found
CocaineConnections,Drugs/Cannabis/Concentrates,Ear Wax - BHO,50mg Wax  Honeycomb wax  pure THC captured with butane and purged until dry wax.  1 per customer - Sample  $0.45  1 Cocaine sample per person 1 THC sample per person,0.01774422,USA,Worldwide,4.8/5,
cocktails,Drugs/Cannabis/Concentrates,50g BHO Shatter @ 18/g SALE SALE SALE,BHO Shatter (same from evo that had lots of rep)    Message for direct discounts/bulk deals,3.614867553,USA,,4.56/5,Average price may be skewed outliar > .5 BTC found
colocures,Drugs/Cannabis/Concentrates,Cannatonic CBD Oil - CO2 Extract - 1g 510/OpenVAPE Cartridge,This Cartridge works with O-pen  Ego Models  Rem Pen - 510 Threads. In case you are not aware or don't have one  they are available to all states legally for bitcoin via their official website: h ...,0.697832797,USA,USA,~5/5,
ConcentratesKing,Drugs/Cannabis/Concentrates,Bhang Stick Black 275mg Indica THC 70%+,Ultra refined cannabis oil No Additives No Glycols No Glycerines 275mg Cannabis Oil,0.246115419,USA,usa,4.984/5,
cosmicbites,Drugs/Cannabis/Concentrates,Watermelon Cosmic Drops 1OZ Bottle,Tasty and fresh  Cosmic's Watermelon Drops bring the sweet  mouth-watering taste watermelon to life. Place a few drops of our marijuana tincture drops under your tongue for maximum efficacy. Cosmic D ...,0.206876002,USA,,4.96/5,
Counsellor,Drugs/Cannabis/Concentrates,14 Grams FOOD GRADE BHO,Hello Fellow Medical Patients. On top of our low cost BHO we are now taking all of our bho that is darker and possibly more waxy and selling it at an even cheaper rate for everyone who can't smoke b ...,0.87754604,USA,,4.94/5,
cultmadeline,Drugs/Cannabis/Concentrates,1g of Honeycomb  Wax (Premium),"You are purchasing 1g of high quality honeycomb extract from our very finest extraction department.  PREMIUM HONEYCOMB WAX for Sophisticated Dabbers   WAX LEVEL II  (Award Winning ""Whipped HoneyC ...",0.239213132,USA France  Sweden  Norway  Asia  Phillipines  Thailand  Hong Kong  Israel  United Kingdom,USA  France  Sweden  Norway  Asia  Phillipines  Thailand  Hong Kong  Israel  United Kingdom,4.997/5,
Customcandy,Drugs/Cannabis/Concentrates,5 g Somango X Mazaar Melt - Solventless Resin,5 g Somango X Mazaar Melt - Solventless Resin  Dry sift !  Dark greenish resin   Extracted from organic outdoor somango mazaar plants  Very strong sweet tropical odor    Bubbles heavy and m ...,0.334536083,EU,,~5/5,
DakotaFred,Drugs/Cannabis/Concentrates,Custom 100 x 1 gram  CO2 Oil in Syringes FREE SHIPPING,100 grams of premium CO2 oil in Syringe. Oil is vacuum purged and decarbed to dispensary standards.. It's fire.  Each syringe is individually labeled and contains 1 gram of premium CO2 oil. most or ...,3.74799822,USA,,5.00/5,
DrEarnhardt,Drugs/Cannabis/Concentrates,5gr Skuff / Kief (connoisseur grade),Quantity: 5gr Quality: very high  This connoisseur grade  very suitable for a party coming up or receiving guests.  Kief (or the Dutch Skuff)  (sometimes transliterated as keef or kif) refers to ...,0.138001289,Netherlands,Worldwide,4.815/5,
DRmagic,Drugs/Cannabis/Concentrates,Toffee Candy 65 mg of THC- VEGETARIAN and GLUTEN FREE,Directly from the DRshrooms' Kitchen  Very delicious and STRONG toffee THC candies  It NOT contains Milk and Gluten. It's VEGETARIAN. It contains honey.  Every candy contains 65 mg of PURE THC ...,0.018669209,EU,Worldwide,4.98/5,
EdWestwick,Drugs/Cannabis/Concentrates,QP (112g) of wax,112 grams of wax concentrates. Wax was urged for 36 hours and contains very little  if any butane at all. Wax can rolled up into a ball and played with. The wax is slightly sticky  it is more like pl ...,5.544245664,USA,,4.95/5,
EmeraldTriangle,Drugs/Cannabis/Concentrates,Melt Your Brain BHO - 16g - FREE SHIPPING,*** Please read our profile for important information before ordering ***   This listing is for 16 grams of our BHO/Wax - FREE SHIPPING  Our unique process creates a concentrate that is dark and ...,2.425770808,USA,,4.88/5,
ExcellentExtracts,Drugs/Cannabis/Concentrates,1g Blackberry Kush stable BHO,This is 1 gram of stable BHO. It is extracted using state of the art closed loop extraction and purged for at least 48 hours in a scientific vacuum oven.   We ship the product as a very stable BHO  ...,0.08518177,USA,,4.91/5,
fulltime,Drugs/Cannabis/Concentrates,Green Cush (crack) God Bud shatter BHO purged Medicinal Grade Shatter 1G,Very High grade shatter. Taste is incredible  extremely potent and clean made in a medicinally approved lab by professionals. Listing is for 1G  Will add pics later  its a dark brown / rich choco ...,0.207568913,Canada,,4.81/5,
GanjaFarmer,Drugs/Cannabis/Concentrates,1/4 Lb of Dab for $2000!,A mix of girl scout cookies and blue dream. Some of the best dab I've ever smoked.,2135.251754,USA,,4.92/5,Average price may be skewed outliar > .5 BTC found
GoombaShop,Drugs/Cannabis/Concentrates,Copy of 1g High Quality BHO Mixed strains  INTRO SALE BUY 3 GET 4!!!,This is some high quality thick butane hash oil  great for dabs! Also good for smearing on a paper or wrap or putting on top of a bowl! This could be used with some vap pens  but is probably too thic ...,0.05110906,USA,USA,4.96/5,
greenhaus,Drugs/Cannabis/Concentrates,FE: 1g concentrate (7g minimum unless made along with a bud order),This is for my first runs of concentrate my new runs are much better and clearer so I am reducing the price on these runs to get it gone to make room for the new stuff. Issues with darkness will not  ...,38.59606264,USA,USA,4.93/5,Average price may be skewed outliar > .5 BTC found
GreenKing,Drugs/Cannabis/Concentrates,ActaBliss Grape Syzurp with cannabinoids medicated syrup,Normal Price is 60 per bottle offering sale for 40 per bottle to next 5 orders     As seen in Time Magazine  Hightimes Magazine  La weekly   This is the real Actabliss   The marijuana syrup e ...,0.06814542,USA,,~5/5,
GreenMountainMan,Drugs/Cannabis/Concentrates,12 X Shatter Tank Vape Pen Cartridges - Hustler's Pak!,Better than O-pen  made from medical grade shatter  strongest vape pen avalilable.  Only ....................$369.00!!!!!   Hustler's Pak! (12) 600mg Shatter Tank Carts for only $369.00.   BONU ...,1.463303528,USA,USA ONLY!,4.93/5,
GreenStreet,Drugs/Cannabis/Concentrates,1oz (28g) Rick Simpson Oil - Medical Grade  Very Clean  80% THC,Uses for Rick Simpson Oil: -Treating Illness (If you google or youtube it there are MANY articles that have been claiming it can kill cancer. This is still in debate  but I'm a believer myself!) -T ...,3.638047415,USA,USA,4.94/5,
GuMbA,Drugs/Cannabis/Concentrates,1g of Medwest CO2 Extracted Wax,This listing is for 1g of Medwest CO2 Gold Wax. This is the purest and some of the highest % of THC you can extract from Marijuana. The strains will vary but don't worry folks  all of the thc% is alw ...,0.37611248,USA,USA,5.00/5,
HerbalHealer,Drugs/Cannabis/Concentrates,Organic Headband Full Melt Bubble Hash (20 grams),Extracted with a 73-micron filter  This marvelous strain is preceded by the legendary OG Kush  powerful Master Kush and classic Sour Diesel.  A great stone before bed  this heavy buzz comes on quic ...,2.280574716,USA,,4.74/5,
HighENDD,Drugs/Cannabis/Concentrates,SHATTER 7g,ALL SHATTER SOLD IS STABLE AT ROOM TEMP 65-75F NUG RUN SHATTER  * some Shatter will be more of a pull-N-Snap consistency - Lab grade closed loop system - purged for 24+ with industrial vacuum ov ...,0.966958738,USA,USA,4.91/5,
HigherStandards,Drugs/Cannabis/Concentrates,7 Grams - Premium Crumble - Wax - Dabs,"This crumble is amazing  Super clean and Flavorful!  7 Grams Premium Crumble Hash Oil   Strain - ""Fire OG Kush"" Quality- Really Really Good  Great flavor. Fully Dry & Purged for days in a hot bo ...",0.84088867,USA,USA,5.00/5,
HumboldtFarms,Drugs/Cannabis/Concentrates,7g Shatter - Skywalker OG - Ultra Pure BHO,::: Skywalker OG Shatter BHO:::  Our shatter is produced in a closed loop system using N Butane and then purged for 12 hours in a Medical Grade Vacuum oven.  ➤ Made from Skywalker OG  an Indica d ...,0.94719468,USA,USA,4.931/5,
HumboldtHerbs,Drugs/Cannabis/Concentrates,Hash Oil - 8g (ESCROW),ESCROW: ON NO FINALIZE EARLY  High quality trim  dry ice kiefed  BHO extracted  and vacuum purged into hash oil. Made by an experienced cook with a refined process.,289.7946891,USA,USA,5.00/5,Average price may be skewed outliar > .5 BTC found
HumboldtsFinest,Drugs/Cannabis/Concentrates,20G BHO HONEY WAX TAFFY EXTREMELY PURE,ITS HERE GUYS!! NOW MAKING MY OWN BHO CONCENTRATE!  GET IT CHEAP WHILE YOU CAN!! THE PRICE MAY GO UP WITH DEMAND. SO TO ALL MY TRUSTING FOLLOWERS  GET IN ON IT WHILE ITS CHEAP!  THIS LISTING IS FO ...,1.43075856,USA,USA,4.973/5,
itewqq,Drugs/Cannabis/Concentrates,5g Dabs (Syrupy THC extract) FREE SHIPPING,NOTE: SPECIFY THE FLAVOR YOU WANT ALONG WITH YOUR NAME/ADDRESS!  TOP OREGON CHRONIC provides the best  medical-grade  chemist-extracted  marijuana concentrates that you can get.  Oregon has a well- ...,0.43442706,USA,,5.00/5,
joogman,Drugs/Cannabis/Concentrates,14 Grams 1/2 oz AAA+++ Top Shelf Girl Scout Cookies Honeycomb Crumble wax,Description  Best wax on the market  best number around. Pictures do not lie. ➤ Vacuum purged 3 days+ ➤ Super clean ➤ High Concentration (80%+ THC) ➤ Recommended for treating stress  anxiety  a ...,1.560669143,USA,USA,4.98/5,
JustSmuggledN!,Drugs/Cannabis/Concentrates,"SALE!!!...2G...""SHARK SHOCK""...BLONDE CRUMBLE WAX!!",This truly beautiful blonde CRUMBLE WAX is unparrelled in quality and effect! Shark Shock CRUMBLE has its origin with White Widow crossed with Northren Lights #1.(Cannabis Cub Winner) The buds used t ...,103.771112,USA,,4.839/5,Average price may be skewed outliar > .5 BTC found
landamann,Drugs/Cannabis/Concentrates,1 g BHO Natural Alcool Extraction,this is made with the cutting part of indica plant.  really deep stone like opium if smoked in a good roor bong.,0.08518177,,,~5/5,
lifecare,Drugs/Cannabis/Concentrates,Medical Grade Rick Simpson Oil (pure/washed),****SALE PRICE $45***SALE PRICE $45***SALE PRICE $45***SALE PRICE $45***  This listing is for 1 gram of the purest rick Simpson oil you will find. It is professionally vac purged and filtered numer ...,0.177929137,USA,worldwide,4.72/5,
Lion,Drugs/Cannabis/Concentrates,1 250mg Open Cartridge,1 Open Cartridges  250mg. Mix and match Sativa  Indica  and Hybrid.,0.209335774,USA,USA,4.799/5,
medibuds,Drugs/Cannabis/Concentrates,6x2.5ml medibuds vape liquid bottle,The same type of vape liquid as the other carts. PEG and cannabis ready for your atomizer like the Pro Tank 3 I offer.,1.370506999,USA,worldwide,4.983/5,
MedicalMJ,Drugs/Cannabis/Concentrates,Custom for da0814,special,1.351450906,USA,,4.83/5,
METHod_Man,Drugs/Cannabis/Concentrates,HEAVY DUTY GLASS PIPE FOR CANNABIS CONCENTRATES - BUY 1 GET 1 FREE!,"Please read my profile before ordering.  - EXTRA THICK GLASS minimizes the chance of the piece breaking  even if you drop it (DON'T BUY OTHER ""HAND-MADE"" PIPES  AS THEY ARE FRAGILE AND BREAK EASILY ...",0.05842366,USA,USA,4.98/5,
MGShoppe,Drugs/Cannabis/Concentrates,3.5 grams of SHATTER MADE OF SOUR DIESEL,3.5 GRAMS OF SHATTER MADE FROM INDOOR SOUR DIESEL 3/18/2015   HELLO! WE ARE NOW HERE.AFTER THE CLOSING OF EVO AND SELLING F.E. ONLY!  for you new to our shoppe this is how we roll  always free  ...,0.473458557,USA,,4.93/5,
MIKEandIKE,Drugs/Cannabis/Concentrates,***----Blue Dream x OG CRUMBLE (28g)----***,This listing is for 28 grams of Blue Dream cross with OG BHO crumble. Really nice product at a great price. Easy to handle with a fairly smooth throat hit. Great for pens  dabs  joints  etc. Buttery  ...,2.258625347,USA,USA,4.96/5,
MrCronk,Drugs/Cannabis/Concentrates,MrCronk's Farmery 1.1g HASH OIL HIGH CBD w FFD,Sweet shiny hash oil with high CBD content made from a decent outdoor strain. We will have a variety of thick oils (sometimes called wax/budder) in future. This is better than Rick Simpson and just p ...,108.1514775,Undeclared;),Worldwide,4.944/5,Average price may be skewed outliar > .5 BTC found
mrfields,Drugs/Cannabis/Concentrates,1g Authentic Rick Simpson Cannabis Oil (From AAA Indica Buds),***** NOW OFFERING EXPRESS OVERNIGHT SHIPPING! *****  FE - In light of the recent DNM seizures of Silk Road 2 and other markets  as well as the most recent issues with Agora  I am now mandating FE  ...,125.3698382,USA,USA,4.99/5,Average price may be skewed outliar > .5 BTC found
Nostress,Drugs/Cannabis/Concentrates,1 Gram of CO2 Extracted Cannabis Wax,This is a listing for 1 gram of CO2 Extracted Cannibis Wax.  In Stock is our Super Gold Crumble. Taste and feel the difference.   XXXOG SOUR OG Skywalker WHITE WIDOW And many others.....,37.57905011,USA,USA,4.929/5,Average price may be skewed outliar > .5 BTC found
notthepoppa,Drugs/Cannabis/Concentrates,7g Topshelf Artisan Shatter (GDP),Artisan Shatter Non-BHO Shatter!! Great tasting  super high potency  GDP & Strawberry Banana Kush  Lab %'s coming soon...  No butane  organic solvent used to extract medicine. Processed by a M ...,1.165724284,USA,,~5/5,
nwconcentrates,Drugs/Cannabis/Concentrates,Qrazy Train Snap Wax (14 Grams),This listing is for our Qrazy Train snap wax.  It smells and tastes great.  Consistency wise we can't call it shatter because it isn't  but its not like wax either  its: snap wax.  Info courtesy of ...,1.373358933,,,5.00/5,
ogbryan,Drugs/Cannabis/Concentrates,"One Ounce of  ""Crumble ""Fucking Awesome",Actual Pic!  Only one available.    I'm slowly getting into the concentrate game  let me know what you think and what you're looking for!  More to come....,3.237362459,USA,,4.973/5,
OneKing,Drugs/Cannabis/Concentrates,~OneKing~ 112G BHO Shatter (SATIVA),High Quality BHO Shatter (SATIVA)   All shatter comes from Strawberry cough syrup (SATIVA) BUDS! Check our other listing if you are looking for the indica shatter! We only use full size buds to pr ...,8.302729839,Canada,,4.42/5,Average price may be skewed outliar > .5 BTC found
PillsAndDrugs,Drugs/Cannabis/Concentrates,Cheeba Chew! 70mg THC! Medical Grade!,Chocolate cheeba chews. Great all day edible  indica based .,0.03407271,USA,USA,4.96/5,
purebase,Drugs/Cannabis/Concentrates,7g BHO / Honeycomb / Wax / Shatter Properly Purged,*PLEASE READ VENDOR PAGE BEFORE PURCHASING* *SHIPPED FROM USA  DOMESTIC ONLY*  *Smell: Overwhelming skittles or orange cream soda  then it morphs into a variety of citrus smells orange  lemon  an ...,0.37479982,USA,USA,5.00/5,
QuikConnect,Drugs/Cannabis/Concentrates,1g BLUEBERRY  Kush Wax! FE LISTING,Excellent taffy like wax! GREAT for dabs! VERY clean & tasty! 88% THC!,0.172537354,USA,,4.97/5,
Republic,Drugs/Cannabis/Concentrates,3ml THC Vape Liquid / E-juice - Hybrid,-------------------  I personally grow all of the plants  and extract the concentrate to insure high quality. This vape liquid is made made without the use of CO2 or Butane. Dropper bottle is seale ...,0.307726736,USA,USA,5.00/5,
sayno2drugs,Drugs/Cannabis/Concentrates,1g Purple Haze Hash(indica),Disclaimer:  By purchasing or engaging in activity and/or conversation in regard to anything at all from this listing  you must agree with the following terms: You are not a law enforcement officer  ...,0.03407271,USA,Worldwide International,5.00/5,
ScoobyDooSmokes67,Drugs/Cannabis/Concentrates,7 Grams BHO! Pineapple Kush Sugar Wax! Tasty Terpy Taffy! Free Priority Shipping!,Greetings Agora! Happy to be here! I have some wonderful BHO  for sale. This a Tasty Terpy Taffy! Darker shade on the outside  lighter yellow in the inside. I call it a sugar wax. Very smelly and fu ...,0.790880921,USA,,4.99/5,
ScoobyDooSmokes67,Drugs/Cannabis/Concentrates,7 Grams BHO! Platinum OG Wax! Free Fast Priority Shipping/WTracking!,Greetings Agora! Happy to be here! I have some wonderful BHO  for sale.   This is a Sugar wax. Taffy like colors. Darker on the outside and light yellow in the inside. Very smelly and tasty! Full o ...,0.739028237,USA,USA,4.99/5,
ScoobyDooSmokes67,Drugs/Cannabis/Concentrates,3.5 Grams Lemon Drop BHO! Free Priority Shipping w/tracking!,Greetings Agora! Happy to be here! I have some wonderful BHO  for sale.  Here's some descriptions : This is a taffy consistency. Awesome smell! Darker on the outside but light in the inside.   Str ...,0.20443626,USA,,4.99/5,
SeattlesBest,Drugs/Cannabis/Concentrates,0.5g Trim Mix Shatter,****FE may be required if you have less than 5 positive feedbacks from other vendors!****   ***All batches are now de-waxed  and everything looks  smells  and tastes great!!  Get some while it las ...,0.085821778,USA,USA,4.977/5,
shatter_kings_710,Drugs/Cannabis/Concentrates,5 Gram ROBOT Extracts SFV OG Nug Run Shatter,This is some top of the line nug run shatter of SFV OF made by the experts at ROBOT Extracts  this would be considered Cannabis Cup Entry material. All orders come in multiples of .5 gram envelopes.  ...,1.129254508,USA,,~5/5,
soulpusher,Drugs/Cannabis/Concentrates,Weed Tincture - 1/2 fl oz,Hello!!  Up for grabs is a NEW line of tinctures. These are everclear alcohol extraction made with PREMIUM INDOOR TRIM! Ultra tasty clean and powerful. Should take about 1 dropper full for total st ...,0.171820642,,,4.76/5,
spacejam023,Drugs/Cannabis/Concentrates,1 Gram Quality Honey Crumble Wax~ Girl Scout Cookies,Here for sale is    1 gram of high quality crumble wax. This was made using the strain girl scout cookie buds  (no shakes  stems or trim)  Check out my store for other similar listings!,0.200611048,USA,,5.00/5,
stoeprand,Drugs/Cannabis/Concentrates,5gr HASH OIL- ultra potent indoor concentrate,HASH OIL clear brown hash oil extracted from A+ quality indoor buds. the color shows very little amount of green desolved within. high purity concentrate with killer taste!,0.964608478,Netherlands,you,4.77/5,
subwaygal,Drugs/Cannabis/Concentrates,O.pen  Vape Pen Cartridge,O-pen Vaporizer Cartridge 250mg This Listing is for a 250mg Cartridge for the O.pen  Vaporizer. This offering is for one Sativa or Indica Cartridge. You choose when ordering.  A great way to dis ...,0.226698723,USA,USA,5.00/5,
Sun-tzu,Drugs/Cannabis/Concentrates,14 grams BLUE DREAM crumble (INDOOR),This crumble is almost white! if you know what the blue dream strain tastes like  you can definitely taste the blue in your lungs.  product has been vacuum purged. Does not sizzle (if your crumble  ...,1.668015735,USA,usa only,5.00/5,
thagoods,Drugs/Cannabis/Concentrates,1 Gram Shatter THC (Pink Champaign),These are made for dispensaries so quality is good..as for the effects you would have to look it up for that specific name  ABOUT ME:  I was a trusted member of SR 1.0 with a 5.0 rating  98 vendo ...,0.102129796,Canada,Canada,4.871/5,
The_L,Drugs/Cannabis/Concentrates,3.5 Grams of SHATTER (Sale!) [Bubba Kush],Very high purity  introductory listing and pricing!  This BHO is made in a closed loop system and then vacuum purged in an industrial oven for >24 hours resulting in <0 ppm butane in the final prod ...,0.51197734,USA,Worldwide,4.863/5,Average price may be skewed outliar > .5 BTC found
