TheBestCannabis,Drugs/Cannabis/Concentrates,3g of Organic Medical BHO {FE} - Free Shipping,Three grams (3g) of the finest quality medical grade BHO  properly purged and produced using organic buds and trim. BHO stands for Butane Honey Oil  and is widely recognized as one of the purest and  ...,124.3348936,USA,USA,4.960/5,Average price may be skewed outliar > .5 BTC found
TheResistance,Drugs/Cannabis/Concentrates,Cannabis Tincture - 5.0 fluid ounces - Organic Alcohol,$105.00 = 5.0 fluid ounces (148 milliliter) Cannabis Tincture. Shipping is free. Your cost is 71 cents per milliliter.  This is Cannabis tincture made with 100% USDA certified Organic Grain alcohol ...,0.436643158,USA,,4.99/5,
TheRoyalOil,Drugs/Cannabis/Concentrates,[HQ] BHO - 1g,Welcome to RoyalOil! Agora's PREMIERE cannabis and concentrate vendor!  Please see our Profile for updates and shipping info.  Here we have our world famous Butane Hash Oil! All of our concentrat ...,0.142040584,USA,Worldwide,4.78/5,
TopShelfBuds,Drugs/Cannabis/Concentrates,1 gram Purple Strawberr Kush BHO - Vac Purged - 5 gram minimum,Highest quality  and lowest price on the dark web. This BHO was made with 99.98% lab grade Butane. it was disolved in hexane and waxes where removed. then it was washed with ethonol and vac purged. w ...,0.0596102,USA,,[0 deals],
Utopic,Drugs/Cannabis/Concentrates,28g | 1oz [Utopic's] TRUSTED A+ Properly Vac Purged ▌Wax \ Crumble / Shatter ▌,[INSANE STEALTH GUARANTEE EVERY ORDER] Properly Purged Wax | Blonde Hash | Cheap AAA Indoor Cannabis ***1000+ SR2 feedback - See my vendor directory link here -> http://directory4iisquf.onion/search? ...,773.6891913,USA,USA,4.846/5,Average price may be skewed outliar > .5 BTC found
vapor_pens,Drugs/Cannabis/Concentrates,O.G. KUSH (WAX  28g),1 oz of O.G. KUSH KRONIC (28g)   Hash oil (also known as hashish oil  BHO  wax  sativa bho  shatter  crumble  indica bho [1] full melt  honey oil ( dabs  or budder) is a form of cannabis. It is a  ...,3.082168916,USA,USA,4.75/5,
weednation,Drugs/Cannabis/Concentrates,50Grams Blueberry Shatter Wax Professionally Purged Rock solid Slabs,ONLY ONE LEFT   FE ONLY!   This shatter is very potent! These Grams are individually packaged for your convenience... Purged from some Indoor blueberry kush. The smoke is very flavorful and very  ...,6.394726476,USA,,4.99/5,
WellnessCenter,Drugs/Cannabis/Concentrates,7 g's of Sour Diesel Wax/BHO/Shatter AAA+ Concentrate!,Sour Diesel Wax/BHO/Shatter. Very strong concentrate. You will love this stuff. Super great for dabs! A little goes a long way. This really is some of the strongest shatter you will every smoke.  T ...,0.89517024,USA,World Wide,5.00/5,
WestCoastCure,Drugs/Cannabis/Concentrates,Girl Scout Cookies WAX BHO (1 Gram Listing)*NEW PRICING*,Girl Scout Cookies WAX BHO (1 Gram Listing)*NEW PRICING*  Bred by The Hemp Center  Girl Scout Cookies was crossed with OG Kush  Durban Poison  and Cherry Kush to create flavors of cotton candy mixe ...,0.206082649,,,4.88/5,
whiteyford,Drugs/Cannabis/Concentrates,1g BHO Oil Kush,BHO Shatter made with kush buds.,0.203460509,Canada,worldwide,4.947/5,
William_Shatner,Drugs/Cannabis/Concentrates,QP of OG Kush Shatter for $2400! Beam Everyone Up!!,William Shatner bringing you OG Kush Shatter!  This is some of the better stuff we've made. Totally stable and snaps right apart. Can hold it in your hand no problem. Can be a little bit darker in  ...,10.1092523,USA,,4.985/5,Average price may be skewed outliar > .5 BTC found
xinhai,Drugs/Cannabis/Concentrates,CAVIAR 7+ grams,Caviar 7+grams  Well organized product that brings new meaning to the word stoned. You get 14+ grams of NorCal green bud that has been saturated in hash oil. Then its tumbled in bubble hash until a ...,209.016631,USA,USA,4.973/5,Average price may be skewed outliar > .5 BTC found
zeltasgarden,Drugs/Cannabis/Concentrates,1 gram Strawberry Dream Crumble Wax,1 gram Strawberry Dream Crumble Wax.  This is some of the best wax you'll find.,0.187705483,USA,USA,4.848/5,
